{
  "schema_name": "review_markers",
  "schema_version": "1.0.0",
  "artifact_id": "art_review_markers_example",
  "project_id": "prj_demo",
  "revision_id": "rev_001",
  "segment_id": "segment_000001",
  "created_at": "2026-07-24T12:00:00Z",
  "producer": {
    "application_version": "0.2.0",
    "stage": "review-marker-import",
    "adapter": "markdown-parser",
    "adapter_version": "1"
  },
  "marker_key": "9999999999999999999999999999999999999999999999999999999999999999",
  "source_markdown": {
    "artifact_id": "review_markdown",
    "path": "C:/projects/prj_demo/review/segments/segment_000001/fixes.md",
    "sha256": "1111111111111111111111111111111111111111111111111111111111111111"
  },
  "source_package": {
    "artifact_id": "segment_review_package",
    "path": "C:/projects/prj_demo/review/segments/segment_000001/review-package.json",
    "sha256": "2222222222222222222222222222222222222222222222222222222222222222"
  },
  "bound_hashes": {
    "preview_sha256": "3333333333333333333333333333333333333333333333333333333333333333",
    "contact_sheet_sha256": "4444444444444444444444444444444444444444444444444444444444444444",
    "transcript_excerpt_sha256": "5555555555555555555555555555555555555555555555555555555555555555",
    "effect_summary_sha256": "6666666666666666666666666666666666666666666666666666666666666666",
    "diagnostics_sha256": "7777777777777777777777777777777777777777777777777777777777777777",
    "fixes_template_sha256": "8888888888888888888888888888888888888888888888888888888888888888"
  },
  "markers": [
    {
      "marker_id": "marker_000001",
      "kind": "FIX",
      "instruction": "Remove the duplicate phrase and preserve the complete second take.",
      "range_us": {"start_us": 4500000, "end_us": 5000000},
      "line_number": 4,
      "raw": "[FIX 00:00:04.500-00:00:05.000] Remove the duplicate phrase and preserve the complete second take."
    }
  ],
  "warnings": [],
  "status": "complete"
}
